{
  "schema": 2,
  "updated_at": "2026-01-01T09:10:00Z",
  "rolling": {
    "7d": {
      "tokens": {
        "input": 1200,
        "output": 300
      },
      "by_model": {},
      "by_tool": {},
      "files_edited": 1,
      "sessions": 1,
      "active_minutes": 10
    },
    "30d": {
      "tokens": {
        "input": 1200,
        "output": 300
      },
      "by_model": {},
      "by_tool": {},
      "files_edited": 1,
      "sessions": 1,
      "active_minutes": 10
    }
  },
  "by_session": {
    "11111111-1111-4111-8111-111111111111": {
      "tokens": {
        "input": 1200,
        "output": 300
      },
      "files": [
        "README.md"
      ],
      "duration_ms": 600000,
      "tools": {},
      "by_model": {}
    }
  },
  "by_runtime": {
    "sample_agent": {
      "tokens": {
        "input": 1200,
        "output": 300
      },
      "by_model": {},
      "by_tool": {},
      "files_edited": 1,
      "sessions": 1,
      "active_minutes": 10
    }
  },
  "by_day": {
    "2026-01-01": {
      "tokens": {
        "input": 1200,
        "output": 300,
        "cache_read": 0,
        "cache_write": 0
      },
      "messages": {
        "total": 4,
        "user": 2,
        "assistant": 2,
        "toolCalls": 1
      },
      "by_model": {}
    }
  }
}
